{
  "component": "text-input",
  "version": "0.0.1",
  "stability": "experimental",
  "accessibilityStatus": "not-reviewed",
  "wcag": [
    {
      "criterion": "4.1.2",
      "level": "A",
      "title": "Name, Role, Value",
      "status": "planned"
    },
    {
      "criterion": "3.3.1",
      "level": "A",
      "title": "Error Identification",
      "status": "planned"
    }
  ],
  "baselineTests": [
    {
      "source": "Section 508 ICT Testing Baseline for Web",
      "test": "Name, Role, Value",
      "status": "planned",
      "evidence": "Planned testing will verify native input semantics, accessible name, and invalid state."
    }
  ],
  "manualTests": [],
  "automatedResults": {},
  "knownLimitations": []
}
