{
  "component": "checkbox",
  "version": "0.0.1",
  "stability": "experimental",
  "accessibilityStatus": "not-reviewed",
  "wcag": [
    {
      "criterion": "4.1.2",
      "level": "A",
      "title": "Name, Role, Value",
      "status": "planned"
    },
    {
      "criterion": "3.3.2",
      "level": "A",
      "title": "Labels or Instructions",
      "status": "planned"
    },
    {
      "criterion": "2.4.7",
      "level": "AA",
      "title": "Focus Visible",
      "status": "planned"
    }
  ],
  "baselineTests": [
    {
      "source": "Section 508 ICT Testing Baseline for Web",
      "test": "Form Fields",
      "status": "planned",
      "evidence": "Planned testing will verify native checkbox role/state, label association, keyboard toggle behavior, and focus visibility."
    }
  ],
  "manualTests": [],
  "automatedResults": {},
  "knownLimitations": []
}
