{
  "component": "alert",
  "version": "0.0.1",
  "stability": "experimental",
  "accessibilityStatus": "not-reviewed",
  "wcag": [
    {
      "criterion": "3.3.1",
      "level": "A",
      "title": "Error Identification",
      "status": "planned"
    },
    {
      "criterion": "4.1.3",
      "level": "AA",
      "title": "Status Messages",
      "status": "planned"
    }
  ],
  "baselineTests": [
    {
      "source": "Section 508 ICT Testing Baseline for Web",
      "test": "Status Messages",
      "status": "planned",
      "evidence": "Planned testing will verify alert text is announced or discoverable when used as a status message."
    }
  ],
  "manualTests": [],
  "automatedResults": {},
  "knownLimitations": []
}
