{
  "component": "radio-group",
  "version": "0.0.1",
  "stability": "experimental",
  "accessibilityStatus": "not-reviewed",
  "wcag": [
    {
      "criterion": "4.1.2",
      "level": "A",
      "title": "Name, Role, Value",
      "status": "planned"
    },
    {
      "criterion": "3.3.2",
      "level": "A",
      "title": "Labels or Instructions",
      "status": "planned"
    },
    {
      "criterion": "1.3.1",
      "level": "A",
      "title": "Info and Relationships",
      "status": "planned"
    },
    {
      "criterion": "2.4.7",
      "level": "AA",
      "title": "Focus Visible",
      "status": "planned"
    }
  ],
  "baselineTests": [
    {
      "source": "Section 508 ICT Testing Baseline for Web",
      "test": "Radio Buttons",
      "status": "planned",
      "evidence": "Planned testing will verify native radio role/state, fieldset and legend grouping, shared name behavior, keyboard operation, and focus visibility."
    }
  ],
  "manualTests": [],
  "automatedResults": {},
  "knownLimitations": []
}
